{
  "schemaVersion": 1,
  "id": "purejsimage-0-17-smoke",
  "title": "PureJsImage 0.17 compatibility smoke",
  "description": "Versioned offline compatibility baseline containing only cases expected to pass PureJsImage 0.17.",
  "intendedUse": "Strict PureJsImage 0.17 compatibility CI",
  "networkPolicy": "offline",
  "maximumVendoredBytes": 26214400,
  "caseIds": [
    "geo/envi/bil-int16",
    "geo/envi/bip-int16",
    "geo/envi/bsq-int16",
    "geo/esri-ascii-grid/tiny",
    "geo/geotiff/wgs84-2x2",
    "geo/netcdf/cf-latlon-int16",
    "geo/srtm-hgt/n00e000-1201",
    "geo/world-file/png-affine",
    "negative/meta-image/mismatched-dimensions",
    "negative/meta-image/missing-companion",
    "negative/png/bad-checksum",
    "negative/png/invalid-chunk-length",
    "negative/qoi/decompression-bomb",
    "negative/qoi/dimension-limit",
    "negative/qoi/integer-overflow",
    "negative/qoi/invalid-magic",
    "negative/qoi/truncated-header",
    "negative/qoi/truncated-payload",
    "negative/qoi/zero-dimensions",
    "negative/tiff/bad-ifd-offset",
    "ordinary/ico/rgba-1x1",
    "ordinary/netpbm/pam-rgba",
    "ordinary/netpbm/pbm-ascii",
    "ordinary/netpbm/pgm-binary",
    "ordinary/netpbm/ppm-binary",
    "ordinary/pfm/rgb-big-endian",
    "ordinary/pfm/rgb-little-endian",
    "ordinary/qoi/rgba-2x2",
    "ordinary/radiance/rgbe-2x2",
    "ordinary/tga/rgb-2x2",
    "ordinary/tiff/gray-2x2",
    "scientific/cbf/uint8-3x2",
    "scientific/envi/bsq-int16",
    "scientific/fits/int16-3x2",
    "scientific/gsf/float32-3x2",
    "scientific/meta-image/int16-3x2",
    "scientific/mrc/int16-3x2",
    "scientific/nanonis-sxm/float32-3x2",
    "scientific/nifti/nifti-1-int16",
    "scientific/nifti/nifti-2-int16",
    "scientific/npy/int16-2x3",
    "scientific/nrrd/int16-3x2",
    "scientific/ome-tiff/uint8-2x2",
    "scientific/rpl/uint16-3x2",
    "scientific/x3p/float32-3x2"
  ],
  "selectors": [],
  "exclusions": []
}
