{
  "schemaVersion": 1,
  "id": "benchmark-content",
  "title": "Benchmark content",
  "description": "Benchmark content cases.",
  "intendedUse": "Benchmark content",
  "networkPolicy": "required",
  "maximumVendoredBytes": 0,
  "caseIds": [
    "ordinary/migrated/animated-gif-cc0",
    "ordinary/migrated/bmpsuite-pal1",
    "ordinary/migrated/bmpsuite-pal4",
    "ordinary/migrated/bmpsuite-pal4-rle",
    "ordinary/migrated/bmpsuite-pal8",
    "ordinary/migrated/bmpsuite-pal8-os2",
    "ordinary/migrated/bmpsuite-pal8-padding-125",
    "ordinary/migrated/bmpsuite-pal8-rle",
    "ordinary/migrated/bmpsuite-pal8-top-down",
    "ordinary/migrated/bmpsuite-pal8-v5",
    "ordinary/migrated/bmpsuite-rgb16-555",
    "ordinary/migrated/bmpsuite-rgb16-565",
    "ordinary/migrated/bmpsuite-rgb24",
    "ordinary/migrated/bmpsuite-rgb32-bitfields",
    "ordinary/migrated/bmpsuite-rgba32-v5",
    "ordinary/migrated/earthrise-2400x2400",
    "ordinary/migrated/exif-orientation-6",
    "ordinary/migrated/iphone12-classic-car-4032x3024-heic",
    "ordinary/migrated/iphone12-greyhounds-4032x3024-heic",
    "ordinary/migrated/iphone12-old-safe-wall-4032x3024-heic",
    "ordinary/migrated/libtiff-deflate-extra-strip-data",
    "ordinary/migrated/libtiff-lzw-single-strip",
    "ordinary/migrated/libtiff-minisblack-1c-8b",
    "ordinary/migrated/libtiff-miniswhite-1c-1b",
    "ordinary/migrated/libtiff-packbits-gray-alpha",
    "ordinary/migrated/libtiff-palette-1c-8b",
    "ordinary/migrated/libtiff-rgb-3c-8b",
    "ordinary/migrated/libultrahdr-apple-gainmap-new",
    "ordinary/migrated/libultrahdr-minnie-rgb",
    "ordinary/migrated/libultrahdr-minnie-yuv-icc",
    "ordinary/migrated/old-faithful-6000x4000",
    "ordinary/migrated/pngsuite-gray-16",
    "ordinary/migrated/pngsuite-palette-8",
    "ordinary/migrated/portrait-2400x3000",
    "ordinary/migrated/tundra-4000x3000",
    "ordinary/migrated/webp-fbi-portrait-1600x2000",
    "ordinary/migrated/webp-gallery-cherry-1024x772",
    "ordinary/migrated/webp-gallery-fire-1024x752",
    "ordinary/migrated/webp-lossless-rose-400x301",
    "ordinary/migrated/webp-lossless-tux-386x395",
    "ordinary/migrated/webp-lossy-alpha-800x600",
    "ordinary/migrated/wpt-webcodecs-mozjpeg-rgb",
    "ordinary/migrated/wpt-webcodecs-mozjpeg-yuv420"
  ],
  "selectors": [],
  "exclusions": []
}
