{
  "schemaVersion": 1,
  "id": "large-range",
  "title": "HTTP range reader cases",
  "description": "HTTP range reader cases cases.",
  "intendedUse": "HTTP range reader cases",
  "networkPolicy": "optional",
  "maximumVendoredBytes": 26214400,
  "caseIds": [],
  "selectors": [
    {
      "feature": "http.range"
    }
  ],
  "exclusions": []
}
